{
  "report_version": "1.0",
  "matrix_version": "1.0",
  "report_id": "report-synthetic-001",
  "task": {
    "project_id": "project-synthetic",
    "worktree_id": "worktree-main",
    "task_id": "task-synthetic",
    "mode": "imported",
    "target_commit": "0000000000000000000000000000000000000000",
    "environment_ref": "environment-synthetic"
  },
  "generated_at": "2026-09-04T00:00:00Z",
  "claim_results": [
    {
      "claim_id": "GM-001",
      "verdict": "supported",
      "requirement_results": [
        {
          "requirement_id": "profile-artifact",
          "subject_ref": "config.synthetic-profile",
          "result": "pass",
          "basis": "observed",
          "evidence_refs": ["evidence-profile-hash", "evidence-profile-parse"],
          "inference_from": [],
          "conflict_refs": [],
          "exact_scope": "합성 Control Profile 파일 한 개"
        }
      ],
      "control_validation_refs": ["control-validation-synthetic-001"],
      "scope": "합성 Control Profile 파일 한 개",
      "conflict_refs": [],
      "residual_risks": ["현재 Codex가 읽지 않았을 수 있음"],
      "permitted_statement": "Control Profile 파일을 생성했다",
      "evaluated_at": "2026-09-04T00:00:00Z"
    },
    {
      "claim_id": "GM-002",
      "verdict": "not_evaluated",
      "requirement_results": [
        {
          "requirement_id": "resolved-config",
          "subject_ref": "config.synthetic-active-source",
          "result": "not_applicable",
          "basis": "observed",
          "evidence_refs": ["evidence-task-mode-imported"],
          "inference_from": [],
          "conflict_refs": [],
          "exact_scope": "Preflight 이전 이력을 포함하지 않는 Imported 합성 Task"
        }
      ],
      "control_validation_refs": [],
      "scope": "현재 합성 Task의 active config source와 resolved value",
      "conflict_refs": [],
      "residual_risks": ["Imported Task 전환 이전의 config loading은 재구성할 수 없음"],
      "permitted_statement": null,
      "evaluated_at": "2026-09-04T00:00:00Z"
    },
    {
      "claim_id": "GM-013",
      "verdict": "contradicted",
      "requirement_results": [
        {
          "requirement_id": "test-run",
          "subject_ref": "test-selection.synthetic",
          "result": "pass",
          "basis": "observed",
          "evidence_refs": ["evidence-test-pass"],
          "inference_from": [],
          "conflict_refs": ["evidence-test-failure"],
          "exact_scope": "합성 test selection"
        }
      ],
      "control_validation_refs": [],
      "scope": "합성 test selection",
      "conflict_refs": ["evidence-test-failure"],
      "residual_risks": ["상충하는 실행 결과의 원인이 아직 분류되지 않음"],
      "permitted_statement": null,
      "evaluated_at": "2026-09-04T00:00:00Z"
    }
  ]
}
